{
  "$schema": "records_under_review.schema.json",
  "schema_version": "1.0.0",
  "title": "Biological Foundation Models — records under review",
  "description": "Audited candidates excluded from the displayed canonical index until their scope, artifact, identity, duplication, or reuse-term issue is resolved.",
  "status": "editorial-hold",
  "date_modified": "2026-08-13",
  "record_count": 39,
  "policy": {
    "displayed_in_index": false,
    "stable_ids_reserved": true,
    "promotion_rule": "A record may move into models_final.json only after the stated reconsideration condition is met, primary evidence is refreshed, and the full maintenance gate passes."
  },
  "entries": [
    {
      "record": {
        "id": "bfm-mrna-fm-plantrna-fm",
        "date_added": "2026-06-16",
        "modality": "rna",
        "name": "mRNA-FM / PlantRNA-FM",
        "description": "RNA-FM-derived models specialized for coding mRNA or plant RNA.",
        "paper_links": [
          {
            "label": "PlantRNA-FM article",
            "url": "https://pmc.ncbi.nlm.nih.gov/articles/PMC11652376/"
          }
        ],
        "code_links": [
          {
            "label": "PlantRNA-FM",
            "url": "https://huggingface.co/yangheng/PlantRNA-FM"
          },
          {
            "label": "mRNA-FM",
            "url": "https://huggingface.co/yangheng/mrnafm"
          }
        ],
        "status": "HOLD — family record mixes two models with incomplete paper evidence and different terms",
        "io": "RNA sequence +/- structure tokens -> embeddings/task outputs",
        "use_cases": "Translation dynamics, plant RNA function, mRNA feature prediction",
        "year": "",
        "canonical": false,
        "noncommercial": false,
        "verified": "2026-08-13",
        "sources": [
          "https://pmc.ncbi.nlm.nih.gov/articles/PMC11652376/",
          "https://huggingface.co/yangheng/PlantRNA-FM",
          "https://huggingface.co/yangheng/mrnafm"
        ],
        "audit_state": "hold",
        "audit_priority": "P2",
        "audit_note": "only PlantRNA-FM has a primary paper link and the two model cards carry different licences. Split or fully evidence both components. Re-reviewed 2026-08-13 (evidence/hold-review-2026-08-13/fm_hold_review_1.json): the split is now evidenced but not executed. PlantRNA-FM is fully documented as an individual member - MIT licence, ungated downloadable weights, its own primary paper - and would be promotable standalone; mRNA-FM's weights are ungated under AGPL-3.0, but its card links only the family preprint, so its own primary evidence is missing. The two members carry conflicting licences, so the combined record cannot be promoted as-is.",
        "audit_source": "evidence/source-audit/foundation_residual_mod1.md",
        "date_modified": "2026-08-13",
        "aliases": []
      },
      "review": {
        "status": "under_review",
        "hold_since": "2026-07-13",
        "reason_code": "family_identity",
        "reason": "only PlantRNA-FM has a primary paper link and the two model cards carry different licences. Split or fully evidence both components. Re-reviewed 2026-08-13 (evidence/hold-review-2026-08-13/fm_hold_review_1.json): the split is now evidenced but not executed. PlantRNA-FM is fully documented as an individual member - MIT licence, ungated downloadable weights, its own primary paper - and would be promotable standalone; mRNA-FM's weights are ungated under AGPL-3.0, but its card links only the family preprint, so its own primary evidence is missing. The two members carry conflicting licences, so the combined record cannot be promoted as-is.",
        "source": "evidence/source-audit/foundation_residual_mod1.md",
        "reconsider_when": "Split the family or verify each member with its own primary evidence, artifact locator, and licence."
      }
    },
    {
      "record": {
        "id": "bfm-saturn",
        "date_added": "2026-06-16",
        "modality": "singlecell",
        "name": "SATURN",
        "description": "Cross-species cell embedding model using protein-language-model gene features.",
        "paper_links": [
          {
            "label": "Nature Methods",
            "url": "https://www.nature.com/articles/s41592-024-02191-z"
          }
        ],
        "code_links": [
          {
            "label": "GitHub",
            "url": "https://github.com/snap-stanford/SATURN"
          }
        ],
        "status": "HOLD — method code and derived embeddings exist, but no reusable pretrained SATURN checkpoint was verified",
        "io": "scRNA counts + protein embeddings + labels -> shared cell embedding",
        "use_cases": "Cross-species integration, homologous cell type mapping",
        "year": "2024",
        "canonical": false,
        "noncommercial": false,
        "verified": "2026-08-13",
        "sources": [
          "https://www.nature.com/articles/s41592-024-02191-z",
          "https://github.com/snap-stanford/SATURN"
        ],
        "audit_state": "hold",
        "audit_priority": "P2",
        "audit_note": "repository provides training code, embeddings and derived macrogene weights, not a reusable pretrained SATURN checkpoint. HOLD or reclassify as method.",
        "audit_source": "evidence/source-audit/foundation_residual_mod1.md",
        "date_modified": "2026-07-13",
        "aliases": []
      },
      "review": {
        "status": "under_review",
        "hold_since": "2026-07-13",
        "reason_code": "artifact",
        "reason": "repository provides training code, embeddings and derived macrogene weights, not a reusable pretrained SATURN checkpoint. HOLD or reclassify as method.",
        "source": "evidence/source-audit/foundation_residual_mod1.md",
        "reconsider_when": "Reconsider when an official reusable pretrained SATURN checkpoint is released and its terms are verified, or reclassify outside model scope."
      }
    },
    {
      "record": {
        "id": "bfm-xtrimogene",
        "date_added": "2026-06-16",
        "modality": "singlecell",
        "name": "xTrimoGene",
        "description": "Efficient scalable representation learner for scRNA-seq.",
        "paper_links": [
          {
            "label": "OpenReview",
            "url": "https://openreview.net/forum?id=gdwcoBCMVi"
          },
          {
            "label": "arXiv",
            "url": "https://arxiv.org/html/2311.15156v2"
          }
        ],
        "code_links": [],
        "status": "HOLD — paper only; no official reusable code or checkpoint verified",
        "io": "Sparse scRNA vector -> embeddings/task predictions",
        "use_cases": "Annotation, perturbation response, drug-combination prediction",
        "year": "",
        "canonical": false,
        "noncommercial": false,
        "verified": "2026-08-13",
        "sources": [
          "https://openreview.net/forum?id=gdwcoBCMVi",
          "https://arxiv.org/html/2311.15156v2"
        ],
        "audit_state": "hold",
        "audit_priority": "P2",
        "audit_note": "paper-only with no official code or checkpoint. HOLD under the reusable-artifact rule.",
        "audit_source": "evidence/source-audit/foundation_residual_mod1.md",
        "date_modified": "2026-07-13",
        "aliases": []
      },
      "review": {
        "status": "under_review",
        "hold_since": "2026-07-13",
        "reason_code": "artifact",
        "reason": "paper-only with no official code or checkpoint. HOLD under the reusable-artifact rule.",
        "source": "evidence/source-audit/foundation_residual_mod1.md",
        "reconsider_when": "Reconsider when official reusable code or a checkpoint is released and verified."
      }
    },
    {
      "record": {
        "id": "bfm-scprotein",
        "date_added": "2026-06-16",
        "modality": "singlecell",
        "name": "scPROTEIN",
        "description": "Graph contrastive model for single-cell proteomics embeddings.",
        "paper_links": [
          {
            "label": "Nature Methods",
            "url": "https://www.nature.com/articles/s41592-024-02214-9"
          }
        ],
        "code_links": [
          {
            "label": "GitHub",
            "url": "https://github.com/TencentAILabHealthcare/scPROTEIN"
          }
        ],
        "status": "HOLD — task framework with dataset-specific checkpoints; broad pretrained-model scope unverified",
        "io": "Single-cell proteomics data -> embeddings",
        "use_cases": "Mass cytometry/CyTOF-style proteomic cell analysis",
        "year": "2024",
        "canonical": false,
        "noncommercial": false,
        "verified": "2026-08-13",
        "sources": [
          "https://www.nature.com/articles/s41592-024-02214-9",
          "https://github.com/TencentAILabHealthcare/scPROTEIN"
        ],
        "audit_state": "hold",
        "audit_priority": "P2",
        "audit_note": "dataset-specific analysis framework/checkpoints do not substantiate a broadly pretrained foundation model. HOLD or reclassify outside scope.",
        "audit_source": "evidence/source-audit/foundation_residual_mod1.md",
        "date_modified": "2026-07-13",
        "aliases": []
      },
      "review": {
        "status": "under_review",
        "hold_since": "2026-07-13",
        "reason_code": "scope",
        "reason": "dataset-specific analysis framework/checkpoints do not substantiate a broadly pretrained foundation model. HOLD or reclassify outside scope.",
        "source": "evidence/source-audit/foundation_residual_mod1.md",
        "reconsider_when": "Reconsider if broader reusable pretraining is evidenced or a written scope-policy revision explicitly includes this class."
      }
    },
    {
      "record": {
        "id": "bfm-deepsea",
        "date_added": "2026-06-16",
        "modality": "dna",
        "name": "DeepSEA",